
 Primary working directories    : /tmp/r2518/290136.maple
 Secondary working directories  : /tmp/r2518/290136.maple
 Wavefunction directory         : /ddn/home1/r2518/wfu/
 Main file repository           : /tmp/r2518/290136.maple/

 SHA1      : d5ffa45e93fdbca01ffc919aa182cfdae0147319
 NAME      : 2015.1.35
 ARCHNAME  : linux/x86_64
 FC        : /opt/intel/composer_xe_2015.1.133/bin/intel64/ifort
 BLASLIB   : -Wl,-_start-group /opt/intel/mkl/lib/intel64/libmkl_intel_ilp64.a /opt/intel/mkl/lib/intel64/libmkl_intel_thread.a /opt/intel/mkl/lib/intel64/libmkl_core.a -Wl,-_end-group
 id        : olemiss

 Nodes     nprocs
 cn070        1

 Using customized tuning parameters: mindgm=1; mindgv=20; mindgc=4; mindgr=1; noblas=0; minvec=7
 default implementation of scratch files=df  

 memory,50,m
 nocompress;
 geomtyp=xyz
 angstrom
 geometry={
 O 0.0 0.0 -0.0657441568
 H 0.0 0.7574590974 0.5217905143
 H 0.0 -0.7574590974 0.5217905143
 }
 basis=cc-pVTZ-F12
 set,charge=0
 set,spin=0
 hf
 {CCSD(T)-F12}

 Variables initialized (889), CPU time= 0.00 sec
 Commands  initialized (702), CPU time= 0.01 sec, 572 directives.
 Default parameters read. Elapsed time= 0.07 sec

 Checking input...
 Passed
1


                                         ***  PROGRAM SYSTEM MOLPRO  ***
                                       Copyright, TTI GmbH Stuttgart, 2015
                                    Version 2015.1 linked Jul  9 2018 13:16:40


 **********************************************************************************************************************************
 LABEL *                                                                                 
  64 bit serial version                                                                  DATE: 31-Mar-20          TIME: 13:31:06  
 **********************************************************************************************************************************

 SHA1:             d5ffa45e93fdbca01ffc919aa182cfdae0147319
 **********************************************************************************************************************************

 Input parameters for SORTINT:

 COMPRESS =    0.000000
 C_FINAL  =    1.000000
 DEBUG    =   -1.000000
 C_SORT1  =    0.000000
 C_SEWARD =    0.000000
 THRESH   =    0.000000
 IO       =  molpro                                                          
 SPRI     =    0.000000
 SETTING GEOMTYP        =    XYZ
 ZUNIT=ANG
 

 Variable memory set to   50000000 words,  buffer space   230000 words

 SETTING BASIS          =    CC-PVTZ-F12
 SETTING CHARGE         =     0.00000000D+00                                  
 SETTING SPIN           =     0.00000000D+00                                  


 Recomputing integrals since basis changed


 Using spherical harmonics

 Library entry O      S cc-pVTZ-F12          selected for orbital group  1
 Library entry O      P cc-pVTZ-F12          selected for orbital group  1
 Library entry O      D cc-pVTZ-F12          selected for orbital group  1
 Library entry O      F cc-pVTZ-F12          selected for orbital group  1
 Library entry H      S cc-pVTZ-F12          selected for orbital group  2
 Library entry H      P cc-pVTZ-F12          selected for orbital group  2
 Library entry H      D cc-pVTZ-F12          selected for orbital group  2


 PROGRAM * SEWARD (Integral evaluation for generally contracted gaussian basis sets)     Author: Roland Lindh, 1990

 Geometry written to block  1 of record 700


 Point group  C2v 



 ATOMIC COORDINATES

 NR  ATOM    CHARGE       X              Y              Z

   1  O       8.00    0.000000000    0.000000000   -0.124238451
   2  H       1.00    0.000000000    1.431390245    0.986041166
   3  H       1.00    0.000000000   -1.431390245    0.986041166

 Bond lengths in Bohr (Angstrom)

 1-2  1.811518385  1-3  1.811518385
     ( 0.958614247)     ( 0.958614247)

 Bond angles

  2-1-3  104.40102305

 NUCLEAR CHARGE:                   10
 NUMBER OF PRIMITIVE AOS:         114
 NUMBER OF SYMMETRY AOS:          103
 NUMBER OF CONTRACTIONS:           89   (  35A1  +  18B1  +  26B2  +  10A2  )
 NUMBER OF CORE ORBITALS:           1   (   1A1  +   0B1  +   0B2  +   0A2  )
 NUMBER OF VALENCE ORBITALS:        6   (   3A1  +   1B1  +   2B2  +   0A2  )


 NUCLEAR REPULSION ENERGY    9.18168040

 Eigenvalues of metric

         1 0.215E-03 0.574E-03 0.711E-03 0.158E-02 0.215E-02 0.396E-02 0.739E-02 0.174E-01
         2 0.691E-03 0.997E-02 0.438E-01 0.839E-01 0.128E+00 0.220E+00 0.245E+00 0.364E+00
         3 0.451E-03 0.795E-03 0.202E-02 0.438E-02 0.867E-02 0.137E-01 0.174E-01 0.451E-01
         4 0.842E-02 0.891E-01 0.190E+00 0.313E+00 0.423E+00 0.586E+00 0.880E+00 0.127E+01


 Contracted 2-electron integrals neglected if value below      1.0D-11

        1872805. INTEGRALS WRITTEN OUT IN     458 BLOCKS ON RECORD 1290 OF FILE 1


 NUMBER OF SORTED TWO-ELECTRON INTEGRALS:    2124910.     BUFFER LENGTH:  32768
 NUMBER OF SEGMENTS:   1  SEGMENT LENGTH:    2124910      RECORD LENGTH: 524288

 Memory used in sort:       2.68 MW

 SORT1 READ     1872805. AND WROTE     1933139. INTEGRALS IN      6 RECORDS. CPU TIME:     0.06 SEC, REAL TIME:     0.08 SEC
 SORT2 READ     1933139. AND WROTE     2124910. INTEGRALS IN      1 RECORDS. CPU TIME:     0.07 SEC, REAL TIME:     0.07 SEC

 FILE SIZES:   FILE 1:    50.1 MBYTE,  FILE 4:    25.2 MBYTE,   TOTAL:     75.3 MBYTE

 OPERATOR DM      FOR CENTER  0  COORDINATES:    0.000000    0.000000    0.000000


 **********************************************************************************************************************************
 DATASETS  * FILE   NREC   LENGTH (MB)   RECORD NAMES
              1      19       35.96       500      610      700      900      950      970     1000      129      960     1100   
                                          VAR    BASINP    GEOM    SYMINP    ZMAT    AOBASIS   BASIS     P2S    ABASIS      S 
                                         1400     1410     1200     1210     1080     1600     1650     1300     1700   
                                           T        V       H0       H01     AOSYM     SMH    MOLCAS    ERIS     OPER   

 PROGRAMS   *        TOTAL       INT
 CPU TIMES  *         0.46      0.37
 REAL TIME  *         0.76 SEC
 DISK USED  *        75.63 MB      
 **********************************************************************************************************************************


 PROGRAM * RHF-SCF (CLOSED SHELL)       Authors: W. Meyer, H.-J. Werner


 NUMBER OF ELECTRONS:       5+    5-
 CONVERGENCE THRESHOLDS:    1.00E-05 (Density)    1.00E-07 (Energy)
 MAX. NUMBER OF ITERATIONS:       60
 INTERPOLATION TYPE:            DIIS
 INTERPOLATION STEPS:              2 (START)      1 (STEP)
 LEVEL SHIFTS:                  0.00 (CLOSED)  0.00 (OPEN) 



 Orbital guess generated from atomic densities. Full valence occupancy:    4   1   2   0

 Molecular orbital dump at record        2100.2

 Initial occupancy:   3   1   1   0

 ITERATION    DDIFF          GRAD             ENERGY        2-EL.EN.            DIPOLE MOMENTS         DIIS   ORB.
    1      0.000D+00      0.000D+00       -76.02700200     77.658521    0.00000    0.00000    1.13623    0    start
    2      0.000D+00      0.185D-01       -76.05394858     74.074069    0.00000    0.00000    0.67659    1    diag
    3      0.205D-01      0.115D-01       -76.06494797     75.651969    0.00000    0.00000    0.79035    2    diag
    4      0.697D-02      0.109D-02       -76.06513247     75.560942    0.00000    0.00000    0.78677    3    diag
    5      0.102D-02      0.295D-03       -76.06515090     75.574909    0.00000    0.00000    0.78548    4    diag
    6      0.356D-03      0.564D-04       -76.06515200     75.573996    0.00000    0.00000    0.78521    5    diag
    7      0.100D-03      0.110D-04       -76.06515205     75.574138    0.00000    0.00000    0.78510    6    diag
    8      0.212D-04      0.219D-05       -76.06515205     75.574129    0.00000    0.00000    0.78506    7    diag
    9      0.393D-05      0.275D-06       -76.06515205     75.574116    0.00000    0.00000    0.78506    0    orth

 Final occupancy:   3   1   1   0

 !RHF STATE 1.1 Energy                -76.065152050176
 Nuclear energy                         9.18168040
 One-electron energy                 -123.03389040
 Two-electron energy                   37.78705796
 Virial quotient                       -1.00099633
 !RHF STATE 1.1 Dipole moment           0.00000000     0.00000000     0.78505771
 Dipole moment /Debye                   0.00000000     0.00000000     1.99528696

 Orbital energies:

         1.1          2.1          3.1          4.1          5.1
    -20.565185    -1.352343    -0.584981     0.101828     0.144893

         1.2          2.2          3.2
     -0.510438     0.145269     0.509069

         1.3          2.3          3.3
     -0.716939     0.120731     0.225743

         1.4          2.4
      0.481027     1.303859

 HOMO      1.2    -0.510438 =     -13.8897eV
 LUMO      4.1     0.101828 =       2.7709eV
 LUMO-HOMO         0.612267 =      16.6606eV


 **********************************************************************************************************************************
 DATASETS  * FILE   NREC   LENGTH (MB)   RECORD NAMES
              1      19       35.96       500      610      700      900      950      970     1000      129      960     1100   
                                          VAR    BASINP    GEOM    SYMINP    ZMAT    AOBASIS   BASIS     P2S    ABASIS      S 
                                         1400     1410     1200     1210     1080     1600     1650     1300     1700   
                                           T        V       H0       H01     AOSYM     SMH    MOLCAS    ERIS     OPER   

              2       4        2.84       700     1000      520     2100   
                                         GEOM     BASIS   MCVARS     RHF  

 PROGRAMS   *        TOTAL        HF       INT
 CPU TIMES  *         0.55      0.09      0.37
 REAL TIME  *         0.89 SEC
 DISK USED  *        75.63 MB      
 **********************************************************************************************************************************


 PROGRAM * CCSD (Closed-shell coupled cluster)     Authors: C. Hampel, H.-J. Werner, 1991, M. Deegan, P.J. Knowles, 1992

                                  CCSD-F12 implementation by  H.-J. Werner, 2007

                   Density fitting integral evaluation by F.R. Manby, 2003,2007, G. Knizia, 2010

 Basis set AUG-CC-PVTZ/JKFIT generated.  Number of basis functions:   196 
 Basis set CC-PVTZ-F12/OPTRI generated.  Number of basis functions:   157 
 Basis set AUG-CC-PVTZ/MP2FIT generated. Number of basis functions:   198 

 Convergence thresholds:  THRVAR = 1.00D-08  THRDEN = 1.00D-06

 CCSD(T)     terms to be evaluated (factor= 1.000)


 Number of core orbitals:           1 (   1   0   0   0 )
 Number of closed-shell orbitals:   4 (   2   1   1   0 )
 Number of external orbitals:      84 (  32  17  25  10 )

 Molecular orbitals read from record     2100.2  Type=RHF/CANONICAL (state 1.1)

 MP2-F12 correlation treatment (H.-J. Werner, 2006)
 ==================================================

 Using MP2-F12 with ansatz 3C(FIX)

 Using projected zeroth-order Hamiltonian (+Z)

 FOCKRIB=T FOCKRIC=T FOCKRIP=T CABSP=T CABSA=T CABSK=T CABSF=T GBC=F EBC=F DMAT=T NOFIK=T NOPAO=1 SOLVE=-1  USEPAO=0
 EXCH_A= T EXCH_B= F EXCH_C= F EXCH_P= F
 
 Geminal basis:    OPTFULL  GEM_TYPE=SLATER  BETA=1.0  NGEM=6

 Optimizing Gaussian exponents for each gem_beta

 Geminal optimization for beta= 1.0000
 Weight function:   m=0, omega= 1.4646

 Augmented Hessian optimization of geminal fit. Trust ratio= 0.40000
 Convergence reached after   2 iterations. Final gradient= 8.41D-16, Step= 4.29D-06, Delta= 1.28D-09
 
 Alpha:                 0.19532     0.81920     2.85917     9.50073    35.69989   197.79328
 Coeff:                 0.27070     0.30552     0.18297     0.10986     0.06810     0.04224
 

 Symmetry turned off. Reference energy:        -76.065152050176

 All pairs explicitly correlated. Number of r12-pairs:           10

 Excluding core orbitals from MO domains
 
 AO(A)-basis ORBITAL           loaded. Number of functions:      89
 RI(R)-basis CC-PVTZ-F12/OPTRI loaded. Number of functions:     157
 DF-basis AUG-CC-PVTZ/JKFIT    loaded. Number of functions:     196

 Screening thresholds:   THRAO=  1.00D-10  THRMO=  1.00D-09  THRPROD=  1.00D-09
                         THRSW=  1.00D-05  THROV=  1.00D-12  THRAOF12=   1.00D-08

 CPU time for Fock operators                      0.91 sec
 
 Construction of ABS:
 Smallest eigenvalue of S          7.83E-04  (threshold= 1.00E-08)
 Ratio eigmin/eigmax               1.31E-04  (threshold= 1.00E-09)
 Smallest eigenvalue of S kept     7.83E-04  (threshold= 7.83E-04, 0 functions deleted, 157 kept)
 
 Construction of CABS:
 Smallest eigenvalue of S          1.86E-06  (threshold= 1.00E-08)
 Ratio eigmin/eigmax               1.86E-06  (threshold= 1.00E-09)
 Smallest eigenvalue of S kept     1.86E-06  (threshold= 1.86E-06, 0 functions deleted, 157 kept)
 
 CPU time for CABS singles                        0.01 sec

 CABS-singles contribution of  -0.00100840 patched into reference energy.
 New reference energy         -76.06616045
 
 AO(A)-basis ORBITAL           loaded. Number of functions:      89
 RI(R)-basis CC-PVTZ-F12/OPTRI loaded. Number of functions:     157
 DF-basis AUG-CC-PVTZ/MP2FIT   loaded. Number of functions:     198

 Screening thresholds:   THRAO=  1.00D-10  THRMO=  1.00D-09  THRPROD=  1.00D-09
                         THRSW=  1.00D-05  THROV=  1.00D-12  THRAOF12=   1.00D-08

 CPU time for 3-index integral evaluation         0.48 sec
 CPU time for second half transformation          0.01 sec (  493.4 MFLOP/sec)
 CPU time for assembly                            0.02 sec (26756.3 MFLOP/sec)
 CPU time for tranop_f12                          0.03 sec (21731.0 MFLOP/sec)
 CPU time for f12 integrals (total)               1.26 sec, Elapsed time:      1.31 sec
 CPU time for f12 matrices (total)                0.01 sec, Elapsed time:      0.01 sec

 Diagonal F12 approximation with fixed coefficients:  TSING= 0.500,  TTRIP= 0.250 (scaled by -1/beta)

 DF-MP2-F12 energy corrections:
 ==============================
 Approx.                                    Singlet             Triplet             Total
 DF-MP2-F12/3*C(DX,FIX)                -0.025262716853     -0.003022171861     -0.028284888714
 DF-MP2-F12/3*C(FIX)                   -0.023464671924     -0.002731587423     -0.026196259347
 DF-MP2-F12/3C(FIX)                    -0.023388754098     -0.002827815053     -0.026216569151

 DF-MP2-F12 correlation energies:
 ================================
 Approx.                                    Singlet             Triplet             Ecorr            Total Energy
 DF-MP2                                -0.173855738073     -0.099225669976     -0.273081408049    -76.339241856538
 DF-MP2-F12/3*C(DX,FIX)                -0.199118454926     -0.102247841837     -0.301366296763    -76.367526745252
 DF-MP2-F12/3*C(FIX)                   -0.197320409997     -0.101957257399     -0.299277667396    -76.365438115885
 DF-MP2-F12/3C(FIX)                    -0.197244492172     -0.102053485029     -0.299297977200    -76.365458425689

 SCS-DF-MP2 energies (F_SING= 1.20000  F_TRIP= 0.62222  F_PARALLEL= 0.33333):
 ============================================================================
 SCS-DF-MP2                            -0.270367302562    -76.336527751051
 SCS-DF-MP2-F12/3*C(DX,FIX)            -0.302563025277    -76.368723473766
 SCS-DF-MP2-F12/3*C(FIX)               -0.300224563267    -76.366385011756
 SCS-DF-MP2-F12/3C(FIX)                -0.300193336846    -76.366353785335

 Symmetry restored.
 Symmetry transformation completed.

 Number of N-1 electron functions:               4
 Number of N-2 electron functions:              10
 Number of singly external CSFs:               106
 Number of doubly external CSFs:             14828
 Total number of CSFs:                       14935

 Length of J-op  integral file:               8.86 MB
 Length of K-op  integral file:              13.00 MB
 Length of 3-ext integral record:             0.00 MB

 Memory could be reduced to 1.33 Mwords without degradation in triples

 Integral transformation finished. Total CPU:   0.03 sec, npass=  1  Memory used:   0.24 MW

 Reference energy:                    -76.06616045

 Adding F12 terms to K(Cij), methodcc=6,  factor= 1.0

 ITER.      SQ.NORM     CORR.ENERGY   TOTAL ENERGY   ENERGY CHANGE        DEN1      VAR(S)    VAR(P)  DIIS     TIME  TIME/IT
   1      1.06144147    -0.27342196   -76.33958241    -0.00029805     0.00546931  0.72D-03  0.95D-03  1  1     2.40     0.03
   2      1.06464009    -0.27315489   -76.33931534     0.00026707    -0.00450560  0.12D-04  0.10D-03  2  2     2.42     0.03
   3      1.06575389    -0.27327871   -76.33943916    -0.00012382    -0.00077470  0.84D-05  0.64D-05  3  3     2.45     0.03
   4      1.06625877    -0.27329963   -76.33946008    -0.00002092    -0.00033776  0.41D-06  0.50D-06  4  4     2.47     0.03
   5      1.06634456    -0.27329808   -76.33945853     0.00000155    -0.00001870  0.12D-06  0.31D-07  5  5     2.49     0.03
   6      1.06636771    -0.27329683   -76.33945728     0.00000125    -0.00000384  0.99D-08  0.31D-08  6  6     2.51     0.03
   7      1.06637367    -0.27329646   -76.33945691     0.00000037    -0.00000137  0.85D-09  0.23D-09  6  1     2.53     0.03
   8      1.06637504    -0.27329652   -76.33945697    -0.00000006    -0.00000001  0.64D-10  0.25D-10  6  2     2.56     0.03

 Norm of t1 vector:      0.03493288      S-energy:    -0.00000010      T1 diagnostic:  0.00873322
                                                                       D1 diagnostic:  0.01745876

 Adding energy correction from Wij-K(Fij), methodcc=6  factor= 1.0
 
  CCSD correlation energy              -0.273296520029
  MP2-F12 correction (uncoupled)       -0.025094096577
  C*T doubles correction               -0.000842481795
  f12b correction                       0.004273036529


 Total CPU time for triples:      0.10 sec


 RESULTS
 =======

  Reference energy                    -76.065152050176
  F12 singles correction               -0.001008398313

 F12 singles corrections added to reference energy

  New reference energy                -76.066160448489

  F12a singlet correction              -0.023214851406
  F12a triplet correction              -0.002721726965
  F12a total correction                -0.025936578372

 F12a corrections for ansatz F12/3C(FIX) added to CCSD energy
 
  CCSD-F12a singlet pair energy        -0.208494941223
  CCSD-F12a triplet pair energy        -0.090738052847
  CCSD-F12a correlation energy         -0.299233098401

  Triples (T) contribution             -0.008719097611
  Total correlation energy             -0.307952196012

  CCSD-F12a total energy              -76.365393546890
  CCSD[T]-F12a energy                 -76.374403718702
  CCSD-T-F12a energy                  -76.373985933764
 !CCSD(T)-F12a total energy           -76.374112644501

 F12b corrections for ansatz F12/3C(FIX) added to CCSD(T)-F12a energy

  CCSD-F12b singlet pair energy        -0.204533471556
  CCSD-F12b triplet pair energy        -0.090426485986
  CCSD-F12b correlation energy         -0.294960061872

  Triples (T) contribution             -0.008719097611
  Total correlation energy             -0.303679159483

  CCSD-F12b total energy              -76.361120510361
  CCSD[T]-F12b energy                 -76.370130682173
  CCSD-T-F12b energy                  -76.369712897235
 !CCSD(T)-F12b total energy           -76.369839607972

 Timing summary (sec):

 STEP                 CPU(USER)    SYS     CPU(TOT)    WALL
 Transformation          0.03      0.00      0.03      0.03
 CCSD iterations         0.23      0.07      0.30      0.31
 Triples                 0.10      0.00      0.10      0.09
 MP2-F12                 2.31      0.08      2.39      2.42
 F12b energy             0.02      0.00      0.02      0.03

 Program statistics:

 Available memory in ccsd:                49999786
 Min. memory needed in ccsd:                 74516
 Max. memory used in ccsd:                   84748
 Max. memory used in cckext:                120394 ( 9 integral passes)



 **********************************************************************************************************************************
 DATASETS  * FILE   NREC   LENGTH (MB)   RECORD NAMES
              1      20       38.72       500      610      700      900      950      970     1000      129      960     1100   
                                          VAR    BASINP    GEOM    SYMINP    ZMAT    AOBASIS   BASIS     P2S    ABASIS      S 
                                         1400     1410     1200     1210     1080     1600     1650     1300     1700     1380   
                                           T        V       H0       H01     AOSYM     SMH    MOLCAS    ERIS     OPER     JKOP   

              2       6        2.89       700     1000      520     2100     7360     7350   
                                         GEOM     BASIS   MCVARS     RHF    F12ABS    EF12   

 PROGRAMS   *        TOTAL   CCSD(T)        HF       INT
 CPU TIMES  *         3.26      2.71      0.09      0.37
 REAL TIME  *         3.81 SEC
 DISK USED  *        78.37 MB      
 **********************************************************************************************************************************

 CCSD(T)-F12/cc-pVTZ-F12 energy=    -76.369839607972

     CCSD(T)-F12        HF-SCF  
    -76.36983961    -76.06515205
 **********************************************************************************************************************************
 Molpro calculation terminated
 Variable memory released
